{"assertions":["asrt:g0:law:trvm:derivation.entry-snapshot@1:loc:crosswalk:c7dba29f2035b84386ac66037693f2ef7c4e05f6:package-v2.7/CROSS_REGISTRY_CLAIM_MAP.json#/records/29/source_ids/0"],"attrs":{"citation":"law:derivation.entry-snapshot@1","registry_hint":"trvm-grid"},"basis":"observed","kind":"LAW","lid":"law:trvm:derivation.entry-snapshot@1","snapshot":"snapshot:g0:multi-v1-ba4e625-d217ee2"}