{"assertions":["asrt:g0:defeater:factory:DEF-R52-REVERSE-INDEX-COPIED:loc:factory:bbc83979a412a5c7279bbb6d44e0bf667372b752:mosaic/defeaters.json#/defeaters/24"],"attrs":{"code":"DEF-R52-REVERSE-INDEX-COPIED","deferred_target_reason":"file-at-revision coordinates only: no rule identity, an unbound symbol/section (the factory's own INC-HIST-SYMBOL is open), and not injective — 34 defeaters carry 28 distinct payloads","disposition":{"incident_ref":"INC-R52-REVERSE-INDEX-DRIFT","kind":"sustained"},"kind":"undercutting","target_digest":"160f33d7b7b0fbc3b810747494e9180f41d8c10ff749f7bc4fbdffa3dae73862","target_digest_bits":256,"target_file":"scripts/check-mosaic.mjs","target_revision":"INV-R5.2","target_section":"§1","target_type":"consumption_rule"},"basis":"observed","kind":"DEFEATER","lid":"defeater:factory:DEF-R52-REVERSE-INDEX-COPIED","snapshot":"snapshot:g0:multi-v1-ba4e625-d217ee2"}