{"assertions":["asrt:g0:defeater:factory:DEF-R92-FORWARDED-UNBOUND:loc:factory:bbc83979a412a5c7279bbb6d44e0bf667372b752:mosaic/defeaters.json#/defeaters/64"],"attrs":{"code":"DEF-R92-FORWARDED-UNBOUND","deferred_target_reason":"file-at-revision coordinates only: no rule identity, an unbound symbol/section (the factory's own INC-HIST-SYMBOL is open), and not injective — 34 defeaters carry 28 distinct payloads","disposition":{"incident_ref":"INC-R92-FORWARDED-UNBOUND","kind":"sustained"},"kind":"undercutting","target_digest":"586cdb33969760ce52146373214ef9553c8eaa910d6cf58a296ad9d433a02d5d","target_digest_bits":256,"target_file":"scripts/integration-kernel.mjs","target_revision":"INV-R9.2","target_section":"forwardedSharedBound","target_type":"consumption_rule"},"basis":"observed","kind":"DEFEATER","lid":"defeater:factory:DEF-R92-FORWARDED-UNBOUND","snapshot":"snapshot:g0:multi-v1-ba4e625-d217ee2"}