{"assertions":["asrt:g0:artifact:trvm-gov:srel-550fc56e15597e69d8b3436925fd3e5c4f978dab8895811f492ce8d4a09c4ffe:loc:trvm-gov:7916e3eb1a7e263e9594e28d9244320099b9adc2:docs/spec/proof-wire/releases/srel-550fc56e15597e69d8b3436925fd3e5c4f978dab8895811f492ce8d4a09c4ffe.json"],"attrs":{"experiment_digest":"1bfe042b59fd983b6f14ee1454915e9e4a26cfce5b2d0ecea28d60976e4d1be2","experiment_files":12,"experiment_revision":2,"holdout_commitment":"86d437fcbd9efee21c5cf27e25564d478592731ae8d2a9e2b9f472a592630071","holdout_entries":10,"jcs_upstream":{"commit":"19d51d7fe467d4706a3ff08adf8a748f29fc21e0","digest":"ce13b5a0325a11c8caa785ad1f959820eef2d9374e8253aa29b50f6232544940","path":"testdata/","repository":"github.com/cyberphone/json-canonicalization","vectors":6},"protocols":{"nested_composition":"TRVM-NESTED-COMPOSITION-v2","verified_claim":"TRVM-VERIFIED-CLAIM-v1","wire":"TRVM-PROOF-WIRE-v1"},"public_corpus_digest":"34a4097377605f1e12460cc91943e25cc399c19238d6309579516c1e3a89fc17","public_corpus_revision":1,"release_type":"TRVM-PROOF-WIRE-SPEC-RELEASE-v1","spec_digest":"2b4e6cc845f83f4bdfef2f7484ca47eb29f2f55eeee570513a132c6f5575fcff","spec_files":4,"spec_release_id":"srel-550fc56e15597e69d8b3436925fd3e5c4f978dab8895811f492ce8d4a09c4ffe","spec_revision":1},"basis":"observed","kind":"ARTIFACT","lid":"artifact:trvm-gov:srel-550fc56e15597e69d8b3436925fd3e5c4f978dab8895811f492ce8d4a09c4ffe","snapshot":"snapshot:g0:tri-ba4e625-d217ee2-8816e59"}