{"assertions":["asrt:g0:witness:factory:scripts/check-mosaic.mjs#12:loc:factory:23141cd132059483c6b1f4aaeb4c241231c43cf9:CLAIM_LEDGER.json#/claims/168/witnesses/0","asrt:g0:witness:factory:scripts/check-mosaic.mjs#12:loc:factory:23141cd132059483c6b1f4aaeb4c241231c43cf9:CLAIM_LEDGER.json#/claims/175/witnesses/0"],"attrs":{"blob":"d883e8add4f3f96c45a0fd2fdc7fb1004989467f","commit":"d217ee29a3322c68db0d43be47491f0e9d4fbc64","kind":"executable","line":2238,"path":"scripts/check-mosaic.mjs","root":"factory","section":"12"},"basis":"observed","kind":"WITNESS","lid":"witness:factory:scripts/check-mosaic.mjs#12","snapshot":"snapshot:g0:multi-ba4e625-d217ee2"}