{"assertions":["asrt:g0:claim:crosswalk:E-23:loc:crosswalk:c7dba29f2035b84386ac66037693f2ef7c4e05f6:package-v2.7/CROSS_REGISTRY_CLAIM_MAP.json#/records/24","asrt:g0:claim:crosswalk:E-23:loc:evstate:f1e9b1532f1bb3a96a3bd4cb25203969d0720e26:package-v2.7/evidence_state.json#/records/24"],"attrs":{"derivation_links_raw":[],"evidence_class_text":"PROPERTY-TESTED","evstate_class":"PROPERTY-TESTED","evstate_class_prev":"PROPERTY-TESTED","evstate_receipts_count":1,"history":[{"token_or_text":"PROPERTY-TESTED","version":"v2.5"},{"token_or_text":"PROPERTY-TESTED","version":"v2.6"}],"name":"ADEQUACY","receipts_typed":false,"relation":"direct","scope_profile_text":"all worlds","semantic_obligation":"S4","source_ids":["meta_laws.ADEQUACY","law:digest.adequacy@2"],"source_registry":"trvm-law-registry","token_family":"TESTED-OTHER"},"basis":"observed","evidence_state":{"token":"PROPERTY-TESTED","vocabulary":"crosswalk"},"kind":"CLAIM","lid":"claim:crosswalk:E-23","snapshot":"snapshot:g0:multi-ba4e625-d217ee2"}