{"assertions":["asrt:g0:definition:crosswalk:DEF:loc:crosswalk:4639a28d888a54abe5c2a804f4bcfc4278566139:package-v2.6/CROSS_REGISTRY_CLAIM_MAP.json#/semantic_obligations"],"attrs":{"category":true,"code":"DEF","name":"definition"},"basis":"observed","kind":"DEFINITION","lid":"definition:crosswalk:DEF","snapshot":"snapshot:g0:historical-699fbc2"}