{"assertions":["asrt:g0:finding:computedriven:F35:loc:crosswalk:c7dba29f2035b84386ac66037693f2ef7c4e05f6:package-v2.7/CROSS_REGISTRY_CLAIM_MAP.json#/r0_8/closed_by_adjudication_v3/2"],"attrs":{"code":"F35"},"basis":"observed","kind":"FINDING","lid":"finding:computedriven:F35","snapshot":"snapshot:g0:tri-ba4e625-d217ee2-8816e59"}