{"assertions":["asrt:g0:claim:factory:EVID-EXH-SCOPE:loc:factory:23141cd132059483c6b1f4aaeb4c241231c43cf9:CLAIM_LEDGER.json#/claims/68"],"attrs":{"assumption_refs":[],"assumptions":[],"binding_form":"path","claim_id":"EVID-EXH-SCOPE","evidence":"Fable's record from Mosaic v1, retained through the merge because the general consumption law would otherwise dissolve a clause this project has already paid for. Round 3 enumerated 287,496 federations at at most 2 constraints per site over 4 variables and read the result as corroboration; the real counterexample carries 56 constraints. ENFORCED IN R5 rather than only stated: a claim whose evidence_kind is `exhaustion` must carry `evidence_qualifiers.space_bound`, and the gate refuses one that does not.","implementation_binding":"mosaic/evidence.json","last_verified":"2026-08-24","prior_art":"Fable 5, Mosaic v1; retained against dissolution by GPT-5.6's audit §4 of the merge.","registry_hint":"factory-ledger","settled_by_policy":false,"statement":"An exhaustion certificate declares the maximum witness its space can express, and may not be consumed for absence outside that bound.","witnesses":["scripts/check-mosaic.mjs §2","scripts/check-mosaic.mjs §5"]},"basis":"observed","evidence_state":{"token":"DECLARED","vocabulary":"factory-ledger"},"kind":"CLAIM","lid":"claim:factory:EVID-EXH-SCOPE","snapshot":"snapshot:g0:multi-ba4e625-d217ee2"}