{"assertions":["asrt:g0:witness:r10:experiments/trvm_contracts/probe_contracts_e42_e43.mjs:loc:crosswalk:c7dba29f2035b84386ac66037693f2ef7c4e05f6:package-v2.7/CROSS_REGISTRY_CLAIM_MAP.json#/records/52/witness_paths/0"],"attrs":{"blob":"486c1f5c3451f22c586958d6791ce7e81d14bc64","commit":"ba4e625871b74f2dbddef18a2098ff0742c54774","kind":"executable","path":"experiments/trvm_contracts/probe_contracts_e42_e43.mjs","root":"r10"},"basis":"observed","kind":"WITNESS","lid":"witness:r10:experiments/trvm_contracts/probe_contracts_e42_e43.mjs","snapshot":"snapshot:g0:multi-ba4e625-d217ee2"}