{"assertions":["asrt:g0:receipt:trvm-gov:brun-4bc38e5327452c4802ff3593dedda24e3f401ca7a1e18de86193a139c0caa0d5.ABORTED:loc:trvm-gov:2e4a4fa4cd7302c9e0fd83a24854ac60cf6df7a4:governance/receipts/brun-4bc38e5327452c4802ff3593dedda24e3f401ca7a1e18de86193a139c0caa0d5.ABORTED.json"],"attrs":{"blind_package_id":"bpkg-cd0d72c1aecb3b5ba021f9dcce95d7a6c4f1faf99881da1e12f2bf0b7164859f","carries_previous":true,"instrument_digest":"734e27825dc2d6b0f8681ab0431dd6f32b5b1b9727d70ec922e46a9e210981e4","note":"aborted: P4.7.3: --state-root removed; the world is where the program lives, and the instrument moved","previous_run_id":"brun-b1de3bafd4ab4252f32d45fa8e9bf4242ce57d4a914f94f264507d26c1bf6be4","previous_status":"PINNED","prose_fields":["note"],"run_id":"brun-4bc38e5327452c4802ff3593dedda24e3f401ca7a1e18de86193a139c0caa0d5","spec_release_id":"srel-1126c37dbbdefd88d15cc7f07e8fae0cd18126ca366e85a1052c2845ebb24cf2","status":"ABORTED","type":"TRVM-BLIND-RUN-RECEIPT-v2"},"basis":"observed","kind":"RECEIPT","lid":"receipt:trvm-gov:brun-4bc38e5327452c4802ff3593dedda24e3f401ca7a1e18de86193a139c0caa0d5.ABORTED","snapshot":"snapshot:g0:tri-ba4e625-d217ee2-8816e59"}