{"assertions":["asrt:g0:transition:crosswalk:E-15:v2.3-before-%3Ev2.4:loc:crosswalk:c7dba29f2035b84386ac66037693f2ef7c4e05f6:package-v2.7/CROSS_REGISTRY_CLAIM_MAP.json#/records/16/evidence_class_v2_4"],"attrs":{"from_text":"in_tree","record":"E-15","to_text":"live_local under a fixed / trusted schema and interpreter: F23's trigger case reaches inside the writer transaction (24 gates + verdict pass at efa8881 against row-level tampering only). Same R0.8.4 repair applies; closure to adjudicate","typed":false},"basis":"observed","kind":"EVIDENCE_STATE_TRANSITION","lid":"transition:crosswalk:E-15:v2.3-before-%3Ev2.4","snapshot":"snapshot:g0:baseline-ba4e625"}