{"assertions":["asrt:g0:registry:crosswalk:r10-pre-v2.7-2026-09-02-v4-adjudication-applied:loc:crosswalk:c7dba29f2035b84386ac66037693f2ef7c4e05f6:package-v2.7/CROSS_REGISTRY_CLAIM_MAP.json"],"attrs":{"adjudications_applied":{"adjudication_v2_4":{"applied":["S1–S5 current map; S6? retired → resolved_candidates","E-13 → E-13a/b/c","E-14 TESTED-CONDITIONAL / FALSIFIED-OPEN","E-15 under trusted schema","E-42 → S4/representation","E-46 → E-46a/b/c","L1? liveness_candidates + witnesses/liveness_l1.py","EXP-1 wording: single correct available witness, two-controller/two-namespace; no cross-host/fault-tolerant claim","drift gate: post-execution status assertions"],"input":"GPT-5.6 R10-pre Execution v1 adjudication, 2026-09-02"},"adjudication_v2_5":{"applied":["package-v2.4 ACCEPT as canonical → v2.5 builds on it","E-13b/E-14/E-15 closures under explicit trust profiles (§2–§4)","R0.8 OPEN with open findings (§5)","FAC-CONTROL-SENSITIVITY → factory candidate (§6)","L1 witness = resolvability; temporal model with declared fairness (§7, Option A + the tiny temporal model)","E-42/E-43 handoff kept; contracts executed as adapters (§8)","gate ingests evidence-state facts (§9)","px13 SHIPPED manifest regenerated after README edits (§10)"],"input":"GPT-5.6 R10-pre Execution v2 adjudication, 2026-09-02 (inputs/R10PRE_EXECUTION_V2_GPT56_ADJUDICATION.md)"},"adjudication_v2_6":{"applied":["§1–§8 R0.8.5 closures + residue","§9 vocabulary","§10 ENV/SYS split","§12 S5 exact profile","§13 E-50 split; REPLAY_RISK_AUTHORIZED not a terminal","§15–§16 A-idempotent, both coordinates (as adapters)","§17 typed promotions + generic kit","§18 v2.6 patch list","§21.2 R0.8.6 handback shipped"],"input":"GPT-5.6 R10-pre Execution v3 adjudication, 2026-09-02 (inputs/R10PRE_EXECUTION_V3_GPT56_ADJUDICATION.md)"},"adjudication_v2_7":{"applied":["§1–§2 F35 CLOSED, order-of-checks accepted","§3–§4 NC29 as the open cut + explicit profile","§5 v2.7 patch","§6 four schema additions","§7 station rule","§8 DECLARED + the narrow claim","§9–§11 E-50a two rules, strict reconciler, SUPERSEDED","§12 SYS-SUCCESSOR-ENABLEMENT","§13–§14 handoffs updated"],"input":"GPT-5.6 R10-pre Execution v4 adjudication, 2026-09-02 (inputs/R10PRE_EXECUTION_V4_GPT56_ADJUDICATION.md)"}},"authority_class":"AUTHORITATIVE","blob":"c7dba29f2035b84386ac66037693f2ef7c4e05f6","commit":"ba4e625871b74f2dbddef18a2098ff0742c54774","declared_unused_categories":["COR"],"execution_summaries":["execution_summary_v2_3","execution_summary_v3","execution_summary_v4","execution_summary_v5"],"field_note":"semantic_obligation = the S-obligation the record serves; relation = how it serves it (direct statement | enforcement mechanism instance | corollary | definition | representation invariant | cross-cutting known law). Split per GPT-5.6 v2 audit §7 so an OS lock and anti-resurrection never share a semantic type. v2.3: source_registry additionally admits \"r10pre-execution\" for records born in the execution lane (experiments/, px13/), which have no prior registry.","not_found_artifacts":["spatial navigation spec","world-to-world boundary/communication spec","resource neighborhood","communication adjacency"],"ontology":["SEMANTIC OBLIGATION","ENFORCEMENT PROPERTY","MECHANISM INSTANCE","WITNESS","TRUST PROFILE"],"registry_status":"DRAFT","repo":"invariant-r10","source_path":"package-v2.7/CROSS_REGISTRY_CLAIM_MAP.json","status_text":"DRAFT — preserves registry origin; nothing merged into CLAIM_LEDGER.json. v2.7 = v2.6 + the GPT-5.6 v4 execution adjudication (2026-09-02), an evidence-state patch: F35 CLOSED under the single-host deployment-anchor profile (E-13b + CLOSED-F35); R0.8 OPEN only for the NC29 authorization/root crash cut — which the computedriven lane has since EXECUTED in R0.8.7, finding F36 and F37 (reproduced then repaired, 21/21, shipped whole, UNADJUDICATED) — plus explicit out-of-scope profile boundaries (power-loss, distributed consensus); E-50a split into two rules (UNKNOWN needs REPLAY_RISK_AUTHORIZED; SATISFIED is done, a repeat is a new intent; FAILED-absent is free) executed in the v2.7 model; L1 names SYS-SUCCESSOR-ENABLEMENT as the third succession assumption, executed; promotions carry class tokens, subject identity and adjudication references; the projection hash is recorded; FAC-CONTROL-SENSITIVITY stays DECLARED and the narrower FAC-EVIDENCE-TRANSITION-SCHEMA-CLOSED is drafted.","tokens_observed":["ARGUMENT","EXHAUSTIVE-IN-MODEL","FALSIFIED-KEPT-RED","FROZEN","PROPERTY-TESTED","PROVED","SPEC","TESTED","TESTED-CONDITIONAL","in_tree","live_local"],"untested_locus_roles":["observation field (partial: warrants)","spatial/topological neighborhood","causal locality","environmental support","resource neighborhood","communication adjacency","spatial navigation","position-scoped policy (WEK W-1, spec)","embodiment/environment coupling","world-to-world boundary semantics"],"version":"r10-pre-v2.7-2026-09-02-v4-adjudication-applied","vocabulary":"crosswalk"},"basis":"observed","kind":"REGISTRY","lid":"registry:crosswalk:r10-pre-v2.7-2026-09-02-v4-adjudication-applied","snapshot":"snapshot:g0:multi-v1-ba4e625-d217ee2"}