{"assertions":["asrt:g0:witness:factory:scripts/check-impact-mutants.mjs#2:loc:factory:23141cd132059483c6b1f4aaeb4c241231c43cf9:CLAIM_LEDGER.json#/claims/172/witnesses/1","asrt:g0:witness:factory:scripts/check-impact-mutants.mjs#2:loc:factory:23141cd132059483c6b1f4aaeb4c241231c43cf9:CLAIM_LEDGER.json#/claims/183/witnesses/0","asrt:g0:witness:factory:scripts/check-impact-mutants.mjs#2:loc:factory:23141cd132059483c6b1f4aaeb4c241231c43cf9:CLAIM_LEDGER.json#/claims/184/witnesses/0"],"attrs":{"blob":"25a861751e442bd092d05a8fc9c505025350017b","commit":"d217ee29a3322c68db0d43be47491f0e9d4fbc64","kind":"executable","line":107,"path":"scripts/check-impact-mutants.mjs","root":"factory","section":"2"},"basis":"observed","kind":"WITNESS","lid":"witness:factory:scripts/check-impact-mutants.mjs#2","snapshot":"snapshot:g0:multi-ba4e625-d217ee2"}