{"assertions":["asrt:g0:witness:r10:package-v2.7/witnesses/adversarial_worlds.py#M3:loc:crosswalk:c7dba29f2035b84386ac66037693f2ef7c4e05f6:package-v2.7/CROSS_REGISTRY_CLAIM_MAP.json#/records/1/witness_paths/2","asrt:g0:witness:r10:package-v2.7/witnesses/adversarial_worlds.py#M3:loc:crosswalk:c7dba29f2035b84386ac66037693f2ef7c4e05f6:package-v2.7/CROSS_REGISTRY_CLAIM_MAP.json#/records/3/witness_paths/2","asrt:g0:witness:r10:package-v2.7/witnesses/adversarial_worlds.py#M3:loc:evstate:f1e9b1532f1bb3a96a3bd4cb25203969d0720e26:package-v2.7/evidence_state.json#/records/1/receipts/2","asrt:g0:witness:r10:package-v2.7/witnesses/adversarial_worlds.py#M3:loc:evstate:f1e9b1532f1bb3a96a3bd4cb25203969d0720e26:package-v2.7/evidence_state.json#/records/3/receipts/2"],"attrs":{"blob":"cc322249a0ef31c33908f74af4f49ca4e109fac0","commit":"ba4e625871b74f2dbddef18a2098ff0742c54774","fragment":"M3","kind":"model-check","path":"package-v2.7/witnesses/adversarial_worlds.py","root":"r10"},"basis":"observed","kind":"WITNESS","lid":"witness:r10:package-v2.7/witnesses/adversarial_worlds.py#M3","snapshot":"snapshot:g0:multi-ba4e625-d217ee2"}