{"assertions":["asrt:g0:artifact:factory:SRC-YANNAKAKIS-1981-SEMIJOIN:loc:factory:8da37028b3c5c4d9d26560bbc662b7aec723bee9:mosaic/sources.json#/sources/3"],"attrs":{"citation":"Yannakakis, Algorithms for Acyclic Database Schemes, VLDB 1981 (with Bernstein & Chiu 1981)","hypotheses":["acyclic scheme","the join tree is available"],"id":"SRC-YANNAKAKIS-1981-SEMIJOIN","registry_hint":"factory-ledger","result":"For an acyclic scheme, one bottom-up then top-down pass of semijoins is a full reducer: it removes exactly the dangling tuples.","role":"cited-result"},"basis":"observed","kind":"ARTIFACT","lid":"artifact:factory:SRC-YANNAKAKIS-1981-SEMIJOIN","snapshot":"snapshot:g0:multi-v1-ba4e625-d217ee2"}