{"assertions":["asrt:g0:witness:r10:px13/COMPUTEDRIVEN_R084_FOR_GPT.tar.gz:loc:crosswalk:4639a28d888a54abe5c2a804f4bcfc4278566139:package-v2.6/CROSS_REGISTRY_CLAIM_MAP.json#/records/13/witness_paths/2","asrt:g0:witness:r10:px13/COMPUTEDRIVEN_R084_FOR_GPT.tar.gz:loc:evstate:8737c78c044543237c3fbfcd4d42ba8f46a6e00d:package-v2.6/evidence_state.json#/records/13/receipts/2"],"attrs":{"blob":"6add27c8de8bd1b5e419a86f5de2b085413e421a","commit":"699fbc2859efdaf57b2391d51dd7712b471e92b9","kind":"bundle","path":"px13/COMPUTEDRIVEN_R084_FOR_GPT.tar.gz","root":"r10"},"basis":"observed","kind":"WITNESS","lid":"witness:r10:px13/COMPUTEDRIVEN_R084_FOR_GPT.tar.gz","snapshot":"snapshot:g0:historical-699fbc2"}