{"assertions":["asrt:g0:assumption:text:h.c7f5cc7c58849b10:loc:factory:23141cd132059483c6b1f4aaeb4c241231c43cf9:CLAIM_LEDGER.json#/claims/80/assumptions/0"],"attrs":{"text":"Externalization is modelled as a spend into an irreversible sink — a modelling choice, registered rather than assumed.","unnormalized":true},"basis":"observed","kind":"ASSUMPTION","lid":"assumption:text:h.c7f5cc7c58849b10","snapshot":"snapshot:g0:tri-ba4e625-d217ee2-8816e59"}