{"assertions":["asrt:g0:assumption:text:h.ceebf47e2faacc50:loc:factory:23141cd132059483c6b1f4aaeb4c241231c43cf9:CLAIM_LEDGER.json#/claims/172/assumptions/1"],"attrs":{"text":"Discharge here means an evidence_ref that resolves. It does not mean the narrowing is TRUE — that is a per-edge proof obligation nobody has met.","unnormalized":true},"basis":"observed","kind":"ASSUMPTION","lid":"assumption:text:h.ceebf47e2faacc50","snapshot":"snapshot:g0:multi-v1-ba4e625-d217ee2"}